<?xml version="1.0" encoding="UTF-8"?>
	<!ELEMENT users (user)+>
	<!ELEMENT user (name,age,sail)>
	<!ELEMENT name (#PCDATA)>
	<!ELEMENT age (#PCDATA)>
	<!ELEMENT sail (#PCDATA)>
